{
  "name": "m36-protocol-plan",
  "domain": "protocol-plan",
  "schemaVersion": 1,
  "schema": "m36-protocol-plan.schema.json",
  "cases": [
    {
      "name": "rule-codec-timed-daily",
      "function": "rule_codec",
      "note": "Data shapes: a timed rule, every day, two sorted times.",
      "input": {"json": {"v": 1, "kind": "timed", "days": {"kind": "daily"}, "times": ["09:00", "21:00"]}},
      "expected": {"v": 1, "kind": "timed", "days": {"kind": "daily"}, "times": ["09:00", "21:00"]}
    },
    {
      "name": "rule-codec-untimed-weekdays",
      "function": "rule_codec",
      "note": "Data shapes: an untimed count on chosen ISO weekdays (1 = Monday).",
      "input": {"json": {"v": 1, "kind": "untimed", "days": {"kind": "weekdays", "weekdays": [1, 3, 5]}, "count": 2}},
      "expected": {"v": 1, "kind": "untimed", "days": {"kind": "weekdays", "weekdays": [1, 3, 5]}, "count": 2}
    },
    {
      "name": "rule-codec-timed-every-n-days",
      "function": "rule_codec",
      "note": "Data shapes: every N days always stores its anchor and whether it is the default.",
      "input": {
        "json": {
          "v": 1,
          "kind": "timed",
          "days": {"kind": "every_n_days", "n": 3, "anchor": "2026-09-01", "anchor_is_default": true},
          "times": ["08:00"]
        }
      },
      "expected": {
        "v": 1,
        "kind": "timed",
        "days": {"kind": "every_n_days", "n": 3, "anchor": "2026-09-01", "anchor_is_default": true},
        "times": ["08:00"]
      }
    },
    {
      "name": "rule-codec-as-needed",
      "function": "rule_codec",
      "note": "Data shapes: as_needed carries no days and no times.",
      "input": {"json": {"v": 1, "kind": "as_needed"}},
      "expected": {"v": 1, "kind": "as_needed"}
    },
    {
      "name": "rule-codec-unscheduled",
      "function": "rule_codec",
      "note": "Data shapes: unscheduled is the member having no Schedule.",
      "input": {"json": {"v": 1, "kind": "unscheduled"}},
      "expected": {"v": 1, "kind": "unscheduled"}
    },
    {
      "name": "rule-codec-rejects-version-other-than-1",
      "function": "rule_codec",
      "note": "File 5: the codecs reject any v other than 1.",
      "input": {"json": {"v": 2, "kind": "timed", "days": {"kind": "daily"}, "times": ["09:00"]}},
      "expected": {"rejects": true}
    },
    {
      "name": "rule-codec-rejects-unknown-rule-kind",
      "function": "rule_codec",
      "note": "File 5: the codecs reject unknown kinds.",
      "input": {"json": {"v": 1, "kind": "cyclic"}},
      "expected": {"rejects": true}
    },
    {
      "name": "rule-codec-rejects-unknown-days-kind",
      "function": "rule_codec",
      "note": "File 5: the codecs reject unknown kinds, including the days kind.",
      "input": {"json": {"v": 1, "kind": "timed", "days": {"kind": "monthly"}, "times": ["09:00"]}},
      "expected": {"rejects": true}
    },
    {
      "name": "rule-codec-rejects-a-time-at-25-00",
      "function": "rule_codec",
      "note": "File 5: a time that is not HH:MM in 00:00-23:59 does not decode, in either language.",
      "input": {"json": {"v": 1, "kind": "timed", "days": {"kind": "daily"}, "times": ["25:00"]}},
      "expected": {"rejects": true}
    },
    {
      "name": "rule-codec-rejects-a-time-without-a-two-digit-hour",
      "function": "rule_codec",
      "note": "File 5: 9:00 is not HH:MM.",
      "input": {"json": {"v": 1, "kind": "timed", "days": {"kind": "daily"}, "times": ["9:00"]}},
      "expected": {"rejects": true}
    },
    {
      "name": "rule-codec-rejects-an-impossible-anchor",
      "function": "rule_codec",
      "note": "File 5: an every-N anchor must be a real date.",
      "input": {"json": {"v": 1, "kind": "untimed", "days": {"kind": "every_n_days", "n": 2, "anchor": "2026-02-30", "anchor_is_default": false}, "count": 1}},
      "expected": {"rejects": true}
    },
    {
      "name": "rule-codec-rejects-a-fractional-count",
      "function": "rule_codec",
      "note": "File 5: a count is an integer.",
      "input": {"json": {"v": 1, "kind": "untimed", "days": {"kind": "daily"}, "count": 2.5}},
      "expected": {"rejects": true}
    },
    {
      "name": "rule-codec-reads-whole-numbers-written-as-floats",
      "function": "rule_codec",
      "note": "File 5: JSON cannot tell 2.0 from 2, so both languages read it as the integer.",
      "input": {"json": {"v": 1.0, "kind": "untimed", "days": {"kind": "weekdays", "weekdays": [1.0, 3]}, "count": 2.0}},
      "expected": {"v": 1, "kind": "untimed", "days": {"kind": "weekdays", "weekdays": [1, 3]}, "count": 2}
    },
    {
      "name": "rule-codec-reads-an-anchor-in-year-50-as-written",
      "function": "rule_codec",
      "note": "File 5: a four-digit year is taken as written, never as 1950.",
      "input": {"json": {"v": 1, "kind": "untimed", "days": {"kind": "every_n_days", "n": 2, "anchor": "0050-01-02", "anchor_is_default": false}, "count": 1}},
      "expected": {"v": 1, "kind": "untimed", "days": {"kind": "every_n_days", "n": 2, "anchor": "0050-01-02", "anchor_is_default": false}, "count": 1}
    },
    {
      "name": "rule-codec-rejects-every-0-days",
      "function": "rule_codec",
      "note": "File 5: plannability is the one range the decoder checks, so the core never plans on a modulo by 0; every N days needs an N of at least 1.",
      "input": {"json": {"v": 1, "kind": "timed", "days": {"kind": "every_n_days", "n": 0, "anchor": "2026-09-01", "anchor_is_default": true}, "times": ["08:00"]}},
      "expected": {"rejects": true}
    },
    {
      "name": "rule-codec-rejects-a-negative-every-n",
      "function": "rule_codec",
      "note": "File 5: every N days with a negative N plans nothing meaningful, so it is rejected like 0.",
      "input": {"json": {"v": 1, "kind": "untimed", "days": {"kind": "every_n_days", "n": -2, "anchor": "2026-09-01", "anchor_is_default": false}, "count": 1}},
      "expected": {"rejects": true}
    },
    {
      "name": "rule-codec-rejects-an-untimed-count-of-0",
      "function": "rule_codec",
      "note": "File 5: an untimed rule plans at least one dose a day; a count of 0 would read as planned with nothing planned.",
      "input": {"json": {"v": 1, "kind": "untimed", "days": {"kind": "daily"}, "count": 0}},
      "expected": {"rejects": true}
    },
    {
      "name": "rule-codec-rejects-a-negative-untimed-count",
      "function": "rule_codec",
      "note": "File 5: a negative count is rejected at the decoder, so neither twin has to plan it.",
      "input": {"json": {"v": 1, "kind": "untimed", "days": {"kind": "weekdays", "weekdays": [1]}, "count": -1}},
      "expected": {"rejects": true}
    },
    {
      "name": "rule-codec-rejects-a-timed-rule-with-no-times",
      "function": "rule_codec",
      "note": "File 5: a timed rule plans at least one time a day.",
      "input": {"json": {"v": 1, "kind": "timed", "days": {"kind": "daily"}, "times": []}},
      "expected": {"rejects": true}
    },
    {
      "name": "rule-codec-reads-an-untimed-count-at-the-ceiling",
      "function": "rule_codec",
      "note": "The decoder's ceiling is the validators' maxUntimedCount: a count of 12 is read.",
      "input": {"json": {"v": 1, "kind": "untimed", "days": {"kind": "daily"}, "count": 12}},
      "expected": {"v": 1, "kind": "untimed", "days": {"kind": "daily"}, "count": 12}
    },
    {
      "name": "rule-codec-rejects-an-untimed-count-above-the-ceiling",
      "function": "rule_codec",
      "note": "A count above maxUntimedCount is rejected at the decoder, so a synced row that was never validated cannot plan an unbounded number of doses.",
      "input": {"json": {"v": 1, "kind": "untimed", "days": {"kind": "daily"}, "count": 13}},
      "expected": {"rejects": true}
    },
    {
      "name": "rule-codec-reads-times-at-the-ceiling",
      "function": "rule_codec",
      "note": "The decoder's ceiling is the validators' maxTimesPerDay: 12 times a day are read.",
      "input": {"json": {"v": 1, "kind": "timed", "days": {"kind": "daily"}, "times": ["08:00", "09:00", "10:00", "11:00", "12:00", "13:00", "14:00", "15:00", "16:00", "17:00", "18:00", "19:00"]}},
      "expected": {"v": 1, "kind": "timed", "days": {"kind": "daily"}, "times": ["08:00", "09:00", "10:00", "11:00", "12:00", "13:00", "14:00", "15:00", "16:00", "17:00", "18:00", "19:00"]}
    },
    {
      "name": "rule-codec-rejects-times-above-the-ceiling",
      "function": "rule_codec",
      "note": "More times than maxTimesPerDay are rejected at the decoder.",
      "input": {"json": {"v": 1, "kind": "timed", "days": {"kind": "daily"}, "times": ["08:00", "09:00", "10:00", "11:00", "12:00", "13:00", "14:00", "15:00", "16:00", "17:00", "18:00", "19:00", "20:00"]}},
      "expected": {"rejects": true}
    },
    {
      "name": "rule-codec-reads-every-n-days-at-the-ceiling",
      "function": "rule_codec",
      "note": "The decoder's ceiling is the validators' maxEveryNDays: every 365 days is read.",
      "input": {"json": {"v": 1, "kind": "timed", "days": {"kind": "every_n_days", "n": 365, "anchor": "2026-09-01", "anchor_is_default": true}, "times": ["08:00"]}},
      "expected": {"v": 1, "kind": "timed", "days": {"kind": "every_n_days", "n": 365, "anchor": "2026-09-01", "anchor_is_default": true}, "times": ["08:00"]}
    },
    {
      "name": "rule-codec-rejects-every-n-days-above-the-ceiling",
      "function": "rule_codec",
      "note": "An N above maxEveryNDays is rejected at the decoder, so neither twin plans on a day count beyond what both languages hold exactly.",
      "input": {"json": {"v": 1, "kind": "untimed", "days": {"kind": "every_n_days", "n": 366, "anchor": "2026-09-01", "anchor_is_default": false}, "count": 1}},
      "expected": {"rejects": true}
    },
    {
      "name": "rule-codec-keeps-unsorted-times-in-stored-order",
      "function": "rule_codec",